[
    { "strName" : "IsSTKFollow_Fail_Cooldown", "strNameFriendly" : "STKFollow Fail Cooldown", "strColor" : "Neutral", "strDesc"  : "[us] tried to STKFollow and can't try it again yet.", "bResetTimer" : true, "nDisplaySelf" : 0, "nDisplayOther" : 0, "fDuration" : 0.1 },
    { "strName" : "IsSTKFollow_Fail_Avoid", "strNameFriendly" : "STKFollow Fail Soft", "strColor" : "Neutral", "strDesc"  : "[us] used a soft fail in STKFollow to avoid a hard fail and can't use it again yet.", "bResetTimer" : true, "nDisplaySelf" : 0, "nDisplayOther" : 0, "fDuration" : 0.1 },
    { "strName" : "IsSTKFollow_Chitchat_Trait_Used", "strNameFriendly" : "STKFollow Chitchat Trait Used", "strColor" : "Neutral", "strDesc"  : "[us] used a trait chitchat move in STKFollow and can't use it again yet.", "bResetTimer" : true, "nDisplaySelf" : 0, "nDisplayOther" : 0, "fDuration" : 0.1 }
]